{"carryovers":[{"evidence":"canonical_data.sell_prices evidence grades/counts: [('landing_backfill', 770757)]","id":"price-temporal-availability","reasonCode":"PRICE_AVAILABILITY_BACKFILLED","state":"unavailable"},{"evidence":"canonical_data.promotions grades/counts/status/type: [('landing_backfill', 40, ['historical'], ['campaign'])]","id":"promotion-origin-visibility","reasonCode":"NO_ORIGIN_VISIBLE_PROMOTION_PLAN","state":"unavailable"},{"evidence":"competitor matches total/attribute-empty: (292, 0)","id":"competitor-match-attributes","reasonCode":null,"state":"available"},{"evidence":"canonical_data.inventory_cost method/grade/counts: [('FIFO', 'native_posted_available', 196415)]","id":"cost-method-provenance","reasonCode":"GENERATED_WAC_LABELLED_FIFO","state":"open"},{"evidence":"inventory_cost ownership is PoC-generated; synthetic scenario only","id":"client-margin-claim","reasonCode":"COST_NOT_CLIENT_ACTUAL","state":"unavailable"},{"evidence":"tools/build_expected_pin.py _active_selections keys by capability","id":"selection-resolution","reasonCode":"CAPABILITY_ONLY_SELECTION_LOOKUP","state":"open"}],"identityExclusions":["/recordId"],"predecessorRecordId":"ec4b9228eced74c86ccbf585b7982ef43fd4064776f483df0dc7d34c8d3e2682","recordId":"3ee56556d3c91622100106150d87c95f48658a3039921d02281bccfd2743fd60","repository":{"branch":"feature/gulf-oil-india-datagen","commit":"12b7a5d59202432ebc46c007e9e924fa3cad35ae","contractHashes":{"contracts/onboarding/capability-entry-pointer.schema.json":"9a7aa3b59e645c705ea07f0153c63da0be9824d893b94ca3f4776bc2957708ea","contracts/onboarding/capability-entry-receipt.schema.json":"95eb75578d0a0c28c49fcc66922a4984e11bb7785eb89043dd258d507c8ee55a","contracts/onboarding/capability-entry-record.schema.json":"b9fb1a86f0fb6c724d238cbc5d6d49b338f041a124e0ff3e900a383b1097a45c","contracts/onboarding/tenant-market-set.schema.json":"f24f8bb1cda44623ab74edc38570f96cef75220e51db35f28e2268953548cdfc"},"dirtyPaths":[],"migrationHead":"0027"},"resumeMatrix":[{"dependency":"source bytes or publication identity","firstConsumer":"source selection and input pin","successorRequired":"source, feature, forecast, inventory, pricing"},{"dependency":"readiness producer or policy","firstConsumer":"readiness sidecar","successorRequired":"readiness and downstream capability consumers"},{"dependency":"feature identity","firstConsumer":"forecast build","successorRequired":"forecast, inventory, pricing"},{"dependency":"forecast identity","firstConsumer":"inventory and pricing context","successorRequired":"inventory and pricing"},{"dependency":"inventory identity","firstConsumer":"pricing context","successorRequired":"pricing"},{"dependency":"pricing model or policy","firstConsumer":"recommendation bundle","successorRequired":"bundle, materialization, activation"},{"dependency":"bundle","firstConsumer":"materialization","successorRequired":"materialization and activation"},{"dependency":"activation set","firstConsumer":"local serving","successorRequired":"server startup and UI"}],"schemaVersion":"retail-capability-entry-record/v1","scope":{"capability":"inventory_replenishment_current_snapshot","environment":"local","retailerId":"retailer-demo","tenantId":"tenant-demo"},"sourceAuthority":{"activeSelection":{"fullScopeResolutionRequired":true,"recordId":"rec_11cebf0c0146c111","recordPath":"contracts/evidence/publication-selections/retailer-demo-inventory-current-ten-year-local-r12-active.json","recordSha256":"4dc6cc5c0b61829c7a188cfa238e4deb73165d9eefbaff920fa72db72a4f8fc9","resolutionMode":"capability_only","selectionId":"sel_b226a700e336bf89"},"expectedPinCheck":{"exitCode":0,"stderr":"","stdout":"expected-pin.json matches its derivation"},"expectedPinPath":"contracts/ml/expected-pin.json","expectedPinSha256":"743822979733b71a4b11de6ed3e9ccd64921b7b47d9ac3f529434c0cdca17ff9","gateAStatus":"pass","gateBStatus":"pass","objectCount":2309,"publicationManifestSha256":"e654cd081ffa619ddd1a6e91e5f2e935410ec8ed5d2a3a52e4f09f4305bed03c","publicationPath":"ingestion/data/curated/run-1430a7ddabc5d4ff","publicationSemanticFingerprint":"7381e88a207750ce4c7190a43c05beb743b417c7b1127ffbe5494604b2cb7559","runId":"run-1430a7ddabc5d4ff","sourceSnapshotId":"7d8ade35bf61ef7a569be1251874a600819eb9e83976f64eb31149574ddcda50"},"tenantMarketSet":{"contractPath":"contracts/evidence/tenant-market-sets/gulf-oil-india-local.json","contractSha256":"aea0b84b25c9c8cc251e3ae81d3346c4e1caa62cab2c2d0f8887f14eff2b6b6e","declaredMarkets":["gulf-india"],"missingDeclaredMarkets":[],"outOfScopePublicationMarkets":[],"publicationMarkets":["gulf-india"]},"uiReview":{"approvedAmendments":["FSP-V1-A1","FSP-V1-A2","FSP-V1-A3","IRP-V1-A1","P4-0P-A1"],"implementedDestinations":16,"openVisualDestinations":16},"upstreamAuthority":{"databaseObservation":{"reason":null,"state":"verified"},"forecast":{"reasonCodes":[],"runId":"fr_546a32b4b120fd7a","semanticFingerprint":"75fb6920647403196a98441650cd4fb3bf585216e523692ae1c4dc8bd3e25d62","state":"active","versionId":"fv_fe8e951c1f54b89e"},"inventory":{"reasonCodes":[],"runId":"ir_4e3bf9f100b8d8dd","semanticFingerprint":"ba30365108e65b4ea92a0ab7fc5d0609b853cd5ffe3baea4886999cd844a056b","state":"active","versionId":"iv_4e3bf9f100b8d8dd"}}}